{
  "experiment_id": "pybughive_hard_auto_skill_first6",
  "model": "gpt-5.5",
  "temperature": 0.0,
  "notes": "Same-model structural-control follow-up: rerun Auto SKILL.md under gpt-5.5 on the same first six PyBugHive Black hard-smoke tasks used by format_shuffled_skill.",
  "budget": {
    "max_turns": 30,
    "max_tokens": 60000,
    "max_cycles": 10
  },
  "runs": [
    {
      "run_id": "pybughive_hard_auto_skill_first6_pybughive_black_132_auto_skill_seed1",
      "task_id": "pybughive_black_132",
      "task_path": "tasks/pybughive_hard/heldout/pybughive_black_132.json",
      "method": "auto_skill",
      "seed": 1,
      "workspace_path": "workspaces/runs/pybughive_hard_auto_skill_first6/pybughive_hard_auto_skill_first6_pybughive_black_132_auto_skill_seed1/repo",
      "artifacts_dir": "runs/pybughive_hard_auto_skill_first6/pybughive_hard_auto_skill_first6_pybughive_black_132_auto_skill_seed1",
      "prompt_path": "prompts/runs/pybughive_hard_auto_skill_first6/pybughive_hard_auto_skill_first6_pybughive_black_132_auto_skill_seed1.md",
      "trajectory_path": "trajectories/pybughive_hard_auto_skill_first6/pybughive_hard_auto_skill_first6_pybughive_black_132_auto_skill_seed1.json",
      "prepare_command": "python3 scripts/prepare_task.py tasks/pybughive_hard/heldout/pybughive_black_132.json --workspace workspaces/runs/pybughive_hard_auto_skill_first6 --checkout-id pybughive_hard_auto_skill_first6_pybughive_black_132_auto_skill_seed1 --force",
      "baseline_context_path": null,
      "memory_path": "memory/pybughive/test_failure_triage/auto_skill.md",
      "requires_memory_artifact": true,
      "prompt_status": "ready"
    },
    {
      "run_id": "pybughive_hard_auto_skill_first6_pybughive_black_133_auto_skill_seed1",
      "task_id": "pybughive_black_133",
      "task_path": "tasks/pybughive_hard/heldout/pybughive_black_133.json",
      "method": "auto_skill",
      "seed": 1,
      "workspace_path": "workspaces/runs/pybughive_hard_auto_skill_first6/pybughive_hard_auto_skill_first6_pybughive_black_133_auto_skill_seed1/repo",
      "artifacts_dir": "runs/pybughive_hard_auto_skill_first6/pybughive_hard_auto_skill_first6_pybughive_black_133_auto_skill_seed1",
      "prompt_path": "prompts/runs/pybughive_hard_auto_skill_first6/pybughive_hard_auto_skill_first6_pybughive_black_133_auto_skill_seed1.md",
      "trajectory_path": "trajectories/pybughive_hard_auto_skill_first6/pybughive_hard_auto_skill_first6_pybughive_black_133_auto_skill_seed1.json",
      "prepare_command": "python3 scripts/prepare_task.py tasks/pybughive_hard/heldout/pybughive_black_133.json --workspace workspaces/runs/pybughive_hard_auto_skill_first6 --checkout-id pybughive_hard_auto_skill_first6_pybughive_black_133_auto_skill_seed1 --force",
      "baseline_context_path": null,
      "memory_path": "memory/pybughive/test_failure_triage/auto_skill.md",
      "requires_memory_artifact": true,
      "prompt_status": "ready"
    },
    {
      "run_id": "pybughive_hard_auto_skill_first6_pybughive_black_154_auto_skill_seed1",
      "task_id": "pybughive_black_154",
      "task_path": "tasks/pybughive_hard/heldout/pybughive_black_154.json",
      "method": "auto_skill",
      "seed": 1,
      "workspace_path": "workspaces/runs/pybughive_hard_auto_skill_first6/pybughive_hard_auto_skill_first6_pybughive_black_154_auto_skill_seed1/repo",
      "artifacts_dir": "runs/pybughive_hard_auto_skill_first6/pybughive_hard_auto_skill_first6_pybughive_black_154_auto_skill_seed1",
      "prompt_path": "prompts/runs/pybughive_hard_auto_skill_first6/pybughive_hard_auto_skill_first6_pybughive_black_154_auto_skill_seed1.md",
      "trajectory_path": "trajectories/pybughive_hard_auto_skill_first6/pybughive_hard_auto_skill_first6_pybughive_black_154_auto_skill_seed1.json",
      "prepare_command": "python3 scripts/prepare_task.py tasks/pybughive_hard/heldout/pybughive_black_154.json --workspace workspaces/runs/pybughive_hard_auto_skill_first6 --checkout-id pybughive_hard_auto_skill_first6_pybughive_black_154_auto_skill_seed1 --force",
      "baseline_context_path": null,
      "memory_path": "memory/pybughive/test_failure_triage/auto_skill.md",
      "requires_memory_artifact": true,
      "prompt_status": "ready"
    },
    {
      "run_id": "pybughive_hard_auto_skill_first6_pybughive_black_183_auto_skill_seed1",
      "task_id": "pybughive_black_183",
      "task_path": "tasks/pybughive_hard/heldout/pybughive_black_183.json",
      "method": "auto_skill",
      "seed": 1,
      "workspace_path": "workspaces/runs/pybughive_hard_auto_skill_first6/pybughive_hard_auto_skill_first6_pybughive_black_183_auto_skill_seed1/repo",
      "artifacts_dir": "runs/pybughive_hard_auto_skill_first6/pybughive_hard_auto_skill_first6_pybughive_black_183_auto_skill_seed1",
      "prompt_path": "prompts/runs/pybughive_hard_auto_skill_first6/pybughive_hard_auto_skill_first6_pybughive_black_183_auto_skill_seed1.md",
      "trajectory_path": "trajectories/pybughive_hard_auto_skill_first6/pybughive_hard_auto_skill_first6_pybughive_black_183_auto_skill_seed1.json",
      "prepare_command": "python3 scripts/prepare_task.py tasks/pybughive_hard/heldout/pybughive_black_183.json --workspace workspaces/runs/pybughive_hard_auto_skill_first6 --checkout-id pybughive_hard_auto_skill_first6_pybughive_black_183_auto_skill_seed1 --force",
      "baseline_context_path": null,
      "memory_path": "memory/pybughive/test_failure_triage/auto_skill.md",
      "requires_memory_artifact": true,
      "prompt_status": "ready"
    },
    {
      "run_id": "pybughive_hard_auto_skill_first6_pybughive_black_193_auto_skill_seed1",
      "task_id": "pybughive_black_193",
      "task_path": "tasks/pybughive_hard/heldout/pybughive_black_193.json",
      "method": "auto_skill",
      "seed": 1,
      "workspace_path": "workspaces/runs/pybughive_hard_auto_skill_first6/pybughive_hard_auto_skill_first6_pybughive_black_193_auto_skill_seed1/repo",
      "artifacts_dir": "runs/pybughive_hard_auto_skill_first6/pybughive_hard_auto_skill_first6_pybughive_black_193_auto_skill_seed1",
      "prompt_path": "prompts/runs/pybughive_hard_auto_skill_first6/pybughive_hard_auto_skill_first6_pybughive_black_193_auto_skill_seed1.md",
      "trajectory_path": "trajectories/pybughive_hard_auto_skill_first6/pybughive_hard_auto_skill_first6_pybughive_black_193_auto_skill_seed1.json",
      "prepare_command": "python3 scripts/prepare_task.py tasks/pybughive_hard/heldout/pybughive_black_193.json --workspace workspaces/runs/pybughive_hard_auto_skill_first6 --checkout-id pybughive_hard_auto_skill_first6_pybughive_black_193_auto_skill_seed1 --force",
      "baseline_context_path": null,
      "memory_path": "memory/pybughive/test_failure_triage/auto_skill.md",
      "requires_memory_artifact": true,
      "prompt_status": "ready"
    },
    {
      "run_id": "pybughive_hard_auto_skill_first6_pybughive_black_232_auto_skill_seed1",
      "task_id": "pybughive_black_232",
      "task_path": "tasks/pybughive_hard/heldout/pybughive_black_232.json",
      "method": "auto_skill",
      "seed": 1,
      "workspace_path": "workspaces/runs/pybughive_hard_auto_skill_first6/pybughive_hard_auto_skill_first6_pybughive_black_232_auto_skill_seed1/repo",
      "artifacts_dir": "runs/pybughive_hard_auto_skill_first6/pybughive_hard_auto_skill_first6_pybughive_black_232_auto_skill_seed1",
      "prompt_path": "prompts/runs/pybughive_hard_auto_skill_first6/pybughive_hard_auto_skill_first6_pybughive_black_232_auto_skill_seed1.md",
      "trajectory_path": "trajectories/pybughive_hard_auto_skill_first6/pybughive_hard_auto_skill_first6_pybughive_black_232_auto_skill_seed1.json",
      "prepare_command": "python3 scripts/prepare_task.py tasks/pybughive_hard/heldout/pybughive_black_232.json --workspace workspaces/runs/pybughive_hard_auto_skill_first6 --checkout-id pybughive_hard_auto_skill_first6_pybughive_black_232_auto_skill_seed1 --force",
      "baseline_context_path": null,
      "memory_path": "memory/pybughive/test_failure_triage/auto_skill.md",
      "requires_memory_artifact": true,
      "prompt_status": "ready"
    }
  ]
}
