{
  "experiment_id": "pybughive_hard_format_shuffled_first6",
  "model": "gpt-5.5",
  "temperature": 0.0,
  "notes": "Structural prompt-control run: format-shuffled SKILL.md on the first six PyBugHive Black hard-smoke tasks. Model-mixed relative to the original first-six gpt-5.3-codex baselines because gpt-5.3-codex is unavailable for this ChatGPT-account Codex CLI session.",
  "budget": {
    "max_turns": 30,
    "max_tokens": 60000,
    "max_cycles": 10
  },
  "runs": [
    {
      "run_id": "pybughive_hard_format_shuffled_first6_pybughive_black_132_format_shuffled_skill_seed1",
      "task_id": "pybughive_black_132",
      "task_path": "tasks/pybughive_hard/heldout/pybughive_black_132.json",
      "method": "format_shuffled_skill",
      "seed": 1,
      "workspace_path": "workspaces/runs/pybughive_hard_format_shuffled_first6/pybughive_hard_format_shuffled_first6_pybughive_black_132_format_shuffled_skill_seed1/repo",
      "artifacts_dir": "runs/pybughive_hard_format_shuffled_first6/pybughive_hard_format_shuffled_first6_pybughive_black_132_format_shuffled_skill_seed1",
      "prompt_path": "prompts/runs/pybughive_hard_format_shuffled_first6/pybughive_hard_format_shuffled_first6_pybughive_black_132_format_shuffled_skill_seed1.md",
      "trajectory_path": "trajectories/pybughive_hard_format_shuffled_first6/pybughive_hard_format_shuffled_first6_pybughive_black_132_format_shuffled_skill_seed1.json",
      "prepare_command": "python3 scripts/prepare_task.py tasks/pybughive_hard/heldout/pybughive_black_132.json --workspace workspaces/runs/pybughive_hard_format_shuffled_first6 --checkout-id pybughive_hard_format_shuffled_first6_pybughive_black_132_format_shuffled_skill_seed1 --force",
      "baseline_context_path": null,
      "memory_path": "memory/pybughive/test_failure_triage/format_shuffled_skill.md",
      "requires_memory_artifact": true,
      "prompt_status": "ready"
    },
    {
      "run_id": "pybughive_hard_format_shuffled_first6_pybughive_black_133_format_shuffled_skill_seed1",
      "task_id": "pybughive_black_133",
      "task_path": "tasks/pybughive_hard/heldout/pybughive_black_133.json",
      "method": "format_shuffled_skill",
      "seed": 1,
      "workspace_path": "workspaces/runs/pybughive_hard_format_shuffled_first6/pybughive_hard_format_shuffled_first6_pybughive_black_133_format_shuffled_skill_seed1/repo",
      "artifacts_dir": "runs/pybughive_hard_format_shuffled_first6/pybughive_hard_format_shuffled_first6_pybughive_black_133_format_shuffled_skill_seed1",
      "prompt_path": "prompts/runs/pybughive_hard_format_shuffled_first6/pybughive_hard_format_shuffled_first6_pybughive_black_133_format_shuffled_skill_seed1.md",
      "trajectory_path": "trajectories/pybughive_hard_format_shuffled_first6/pybughive_hard_format_shuffled_first6_pybughive_black_133_format_shuffled_skill_seed1.json",
      "prepare_command": "python3 scripts/prepare_task.py tasks/pybughive_hard/heldout/pybughive_black_133.json --workspace workspaces/runs/pybughive_hard_format_shuffled_first6 --checkout-id pybughive_hard_format_shuffled_first6_pybughive_black_133_format_shuffled_skill_seed1 --force",
      "baseline_context_path": null,
      "memory_path": "memory/pybughive/test_failure_triage/format_shuffled_skill.md",
      "requires_memory_artifact": true,
      "prompt_status": "ready"
    },
    {
      "run_id": "pybughive_hard_format_shuffled_first6_pybughive_black_154_format_shuffled_skill_seed1",
      "task_id": "pybughive_black_154",
      "task_path": "tasks/pybughive_hard/heldout/pybughive_black_154.json",
      "method": "format_shuffled_skill",
      "seed": 1,
      "workspace_path": "workspaces/runs/pybughive_hard_format_shuffled_first6/pybughive_hard_format_shuffled_first6_pybughive_black_154_format_shuffled_skill_seed1/repo",
      "artifacts_dir": "runs/pybughive_hard_format_shuffled_first6/pybughive_hard_format_shuffled_first6_pybughive_black_154_format_shuffled_skill_seed1",
      "prompt_path": "prompts/runs/pybughive_hard_format_shuffled_first6/pybughive_hard_format_shuffled_first6_pybughive_black_154_format_shuffled_skill_seed1.md",
      "trajectory_path": "trajectories/pybughive_hard_format_shuffled_first6/pybughive_hard_format_shuffled_first6_pybughive_black_154_format_shuffled_skill_seed1.json",
      "prepare_command": "python3 scripts/prepare_task.py tasks/pybughive_hard/heldout/pybughive_black_154.json --workspace workspaces/runs/pybughive_hard_format_shuffled_first6 --checkout-id pybughive_hard_format_shuffled_first6_pybughive_black_154_format_shuffled_skill_seed1 --force",
      "baseline_context_path": null,
      "memory_path": "memory/pybughive/test_failure_triage/format_shuffled_skill.md",
      "requires_memory_artifact": true,
      "prompt_status": "ready"
    },
    {
      "run_id": "pybughive_hard_format_shuffled_first6_pybughive_black_183_format_shuffled_skill_seed1",
      "task_id": "pybughive_black_183",
      "task_path": "tasks/pybughive_hard/heldout/pybughive_black_183.json",
      "method": "format_shuffled_skill",
      "seed": 1,
      "workspace_path": "workspaces/runs/pybughive_hard_format_shuffled_first6/pybughive_hard_format_shuffled_first6_pybughive_black_183_format_shuffled_skill_seed1/repo",
      "artifacts_dir": "runs/pybughive_hard_format_shuffled_first6/pybughive_hard_format_shuffled_first6_pybughive_black_183_format_shuffled_skill_seed1",
      "prompt_path": "prompts/runs/pybughive_hard_format_shuffled_first6/pybughive_hard_format_shuffled_first6_pybughive_black_183_format_shuffled_skill_seed1.md",
      "trajectory_path": "trajectories/pybughive_hard_format_shuffled_first6/pybughive_hard_format_shuffled_first6_pybughive_black_183_format_shuffled_skill_seed1.json",
      "prepare_command": "python3 scripts/prepare_task.py tasks/pybughive_hard/heldout/pybughive_black_183.json --workspace workspaces/runs/pybughive_hard_format_shuffled_first6 --checkout-id pybughive_hard_format_shuffled_first6_pybughive_black_183_format_shuffled_skill_seed1 --force",
      "baseline_context_path": null,
      "memory_path": "memory/pybughive/test_failure_triage/format_shuffled_skill.md",
      "requires_memory_artifact": true,
      "prompt_status": "ready"
    },
    {
      "run_id": "pybughive_hard_format_shuffled_first6_pybughive_black_193_format_shuffled_skill_seed1",
      "task_id": "pybughive_black_193",
      "task_path": "tasks/pybughive_hard/heldout/pybughive_black_193.json",
      "method": "format_shuffled_skill",
      "seed": 1,
      "workspace_path": "workspaces/runs/pybughive_hard_format_shuffled_first6/pybughive_hard_format_shuffled_first6_pybughive_black_193_format_shuffled_skill_seed1/repo",
      "artifacts_dir": "runs/pybughive_hard_format_shuffled_first6/pybughive_hard_format_shuffled_first6_pybughive_black_193_format_shuffled_skill_seed1",
      "prompt_path": "prompts/runs/pybughive_hard_format_shuffled_first6/pybughive_hard_format_shuffled_first6_pybughive_black_193_format_shuffled_skill_seed1.md",
      "trajectory_path": "trajectories/pybughive_hard_format_shuffled_first6/pybughive_hard_format_shuffled_first6_pybughive_black_193_format_shuffled_skill_seed1.json",
      "prepare_command": "python3 scripts/prepare_task.py tasks/pybughive_hard/heldout/pybughive_black_193.json --workspace workspaces/runs/pybughive_hard_format_shuffled_first6 --checkout-id pybughive_hard_format_shuffled_first6_pybughive_black_193_format_shuffled_skill_seed1 --force",
      "baseline_context_path": null,
      "memory_path": "memory/pybughive/test_failure_triage/format_shuffled_skill.md",
      "requires_memory_artifact": true,
      "prompt_status": "ready"
    },
    {
      "run_id": "pybughive_hard_format_shuffled_first6_pybughive_black_232_format_shuffled_skill_seed1",
      "task_id": "pybughive_black_232",
      "task_path": "tasks/pybughive_hard/heldout/pybughive_black_232.json",
      "method": "format_shuffled_skill",
      "seed": 1,
      "workspace_path": "workspaces/runs/pybughive_hard_format_shuffled_first6/pybughive_hard_format_shuffled_first6_pybughive_black_232_format_shuffled_skill_seed1/repo",
      "artifacts_dir": "runs/pybughive_hard_format_shuffled_first6/pybughive_hard_format_shuffled_first6_pybughive_black_232_format_shuffled_skill_seed1",
      "prompt_path": "prompts/runs/pybughive_hard_format_shuffled_first6/pybughive_hard_format_shuffled_first6_pybughive_black_232_format_shuffled_skill_seed1.md",
      "trajectory_path": "trajectories/pybughive_hard_format_shuffled_first6/pybughive_hard_format_shuffled_first6_pybughive_black_232_format_shuffled_skill_seed1.json",
      "prepare_command": "python3 scripts/prepare_task.py tasks/pybughive_hard/heldout/pybughive_black_232.json --workspace workspaces/runs/pybughive_hard_format_shuffled_first6 --checkout-id pybughive_hard_format_shuffled_first6_pybughive_black_232_format_shuffled_skill_seed1 --force",
      "baseline_context_path": null,
      "memory_path": "memory/pybughive/test_failure_triage/format_shuffled_skill.md",
      "requires_memory_artifact": true,
      "prompt_status": "ready"
    }
  ]
}
