{
  "experiment_id": "pilot_memory_baselines",
  "model": "manual-agent",
  "temperature": 0.0,
  "notes": "Runnable pilot manifest for memory baselines; oracle skill excluded until human-authored.",
  "budget": {
    "max_turns": 30,
    "max_tokens": 60000,
    "max_cycles": 10
  },
  "runs": [
    {
      "run_id": "pilot_memory_baselines_local_empty_input_bug_no_memory_seed1",
      "task_id": "local_empty_input_bug",
      "task_path": "tasks/train/local_empty_input_bug.json",
      "method": "no_memory",
      "seed": 1,
      "workspace_path": "workspaces/runs/pilot_memory_baselines/pilot_memory_baselines_local_empty_input_bug_no_memory_seed1/repo",
      "artifacts_dir": "runs/pilot_memory_baselines/pilot_memory_baselines_local_empty_input_bug_no_memory_seed1",
      "prompt_path": "prompts/runs/pilot_memory_baselines/pilot_memory_baselines_local_empty_input_bug_no_memory_seed1.md",
      "trajectory_path": "trajectories/pilot_memory_baselines/pilot_memory_baselines_local_empty_input_bug_no_memory_seed1.json",
      "prepare_command": "python scripts/prepare_task.py tasks/train/local_empty_input_bug.json --workspace workspaces/runs/pilot_memory_baselines --checkout-id pilot_memory_baselines_local_empty_input_bug_no_memory_seed1 --force",
      "baseline_context_path": null,
      "memory_path": null,
      "requires_memory_artifact": false,
      "prompt_status": "ready"
    },
    {
      "run_id": "pilot_memory_baselines_local_empty_input_bug_generic_checklist_seed1",
      "task_id": "local_empty_input_bug",
      "task_path": "tasks/train/local_empty_input_bug.json",
      "method": "generic_checklist",
      "seed": 1,
      "workspace_path": "workspaces/runs/pilot_memory_baselines/pilot_memory_baselines_local_empty_input_bug_generic_checklist_seed1/repo",
      "artifacts_dir": "runs/pilot_memory_baselines/pilot_memory_baselines_local_empty_input_bug_generic_checklist_seed1",
      "prompt_path": "prompts/runs/pilot_memory_baselines/pilot_memory_baselines_local_empty_input_bug_generic_checklist_seed1.md",
      "trajectory_path": "trajectories/pilot_memory_baselines/pilot_memory_baselines_local_empty_input_bug_generic_checklist_seed1.json",
      "prepare_command": "python scripts/prepare_task.py tasks/train/local_empty_input_bug.json --workspace workspaces/runs/pilot_memory_baselines --checkout-id pilot_memory_baselines_local_empty_input_bug_generic_checklist_seed1 --force",
      "baseline_context_path": "baselines/generic_debugging_checklist.md",
      "memory_path": null,
      "requires_memory_artifact": false,
      "prompt_status": "ready"
    },
    {
      "run_id": "pilot_memory_baselines_local_empty_input_bug_reflexion_seed1",
      "task_id": "local_empty_input_bug",
      "task_path": "tasks/train/local_empty_input_bug.json",
      "method": "reflexion",
      "seed": 1,
      "workspace_path": "workspaces/runs/pilot_memory_baselines/pilot_memory_baselines_local_empty_input_bug_reflexion_seed1/repo",
      "artifacts_dir": "runs/pilot_memory_baselines/pilot_memory_baselines_local_empty_input_bug_reflexion_seed1",
      "prompt_path": "prompts/runs/pilot_memory_baselines/pilot_memory_baselines_local_empty_input_bug_reflexion_seed1.md",
      "trajectory_path": "trajectories/pilot_memory_baselines/pilot_memory_baselines_local_empty_input_bug_reflexion_seed1.json",
      "prepare_command": "python scripts/prepare_task.py tasks/train/local_empty_input_bug.json --workspace workspaces/runs/pilot_memory_baselines --checkout-id pilot_memory_baselines_local_empty_input_bug_reflexion_seed1 --force",
      "baseline_context_path": null,
      "memory_path": "memory/test_failure_triage/reflexion.md",
      "requires_memory_artifact": true,
      "prompt_status": "ready"
    },
    {
      "run_id": "pilot_memory_baselines_local_empty_input_bug_length_matched_reflexion_seed1",
      "task_id": "local_empty_input_bug",
      "task_path": "tasks/train/local_empty_input_bug.json",
      "method": "length_matched_reflexion",
      "seed": 1,
      "workspace_path": "workspaces/runs/pilot_memory_baselines/pilot_memory_baselines_local_empty_input_bug_length_matched_reflexion_seed1/repo",
      "artifacts_dir": "runs/pilot_memory_baselines/pilot_memory_baselines_local_empty_input_bug_length_matched_reflexion_seed1",
      "prompt_path": "prompts/runs/pilot_memory_baselines/pilot_memory_baselines_local_empty_input_bug_length_matched_reflexion_seed1.md",
      "trajectory_path": "trajectories/pilot_memory_baselines/pilot_memory_baselines_local_empty_input_bug_length_matched_reflexion_seed1.json",
      "prepare_command": "python scripts/prepare_task.py tasks/train/local_empty_input_bug.json --workspace workspaces/runs/pilot_memory_baselines --checkout-id pilot_memory_baselines_local_empty_input_bug_length_matched_reflexion_seed1 --force",
      "baseline_context_path": null,
      "memory_path": "memory/test_failure_triage/length_matched_reflexion.md",
      "requires_memory_artifact": true,
      "prompt_status": "ready"
    },
    {
      "run_id": "pilot_memory_baselines_local_empty_input_bug_raw_trajectory_retrieval_seed1",
      "task_id": "local_empty_input_bug",
      "task_path": "tasks/train/local_empty_input_bug.json",
      "method": "raw_trajectory_retrieval",
      "seed": 1,
      "workspace_path": "workspaces/runs/pilot_memory_baselines/pilot_memory_baselines_local_empty_input_bug_raw_trajectory_retrieval_seed1/repo",
      "artifacts_dir": "runs/pilot_memory_baselines/pilot_memory_baselines_local_empty_input_bug_raw_trajectory_retrieval_seed1",
      "prompt_path": "prompts/runs/pilot_memory_baselines/pilot_memory_baselines_local_empty_input_bug_raw_trajectory_retrieval_seed1.md",
      "trajectory_path": "trajectories/pilot_memory_baselines/pilot_memory_baselines_local_empty_input_bug_raw_trajectory_retrieval_seed1.json",
      "prepare_command": "python scripts/prepare_task.py tasks/train/local_empty_input_bug.json --workspace workspaces/runs/pilot_memory_baselines --checkout-id pilot_memory_baselines_local_empty_input_bug_raw_trajectory_retrieval_seed1 --force",
      "baseline_context_path": null,
      "memory_path": "memory/test_failure_triage/raw_trajectory_retrieval.md",
      "requires_memory_artifact": true,
      "prompt_status": "ready"
    },
    {
      "run_id": "pilot_memory_baselines_local_empty_input_bug_format_shuffled_skill_seed1",
      "task_id": "local_empty_input_bug",
      "task_path": "tasks/train/local_empty_input_bug.json",
      "method": "format_shuffled_skill",
      "seed": 1,
      "workspace_path": "workspaces/runs/pilot_memory_baselines/pilot_memory_baselines_local_empty_input_bug_format_shuffled_skill_seed1/repo",
      "artifacts_dir": "runs/pilot_memory_baselines/pilot_memory_baselines_local_empty_input_bug_format_shuffled_skill_seed1",
      "prompt_path": "prompts/runs/pilot_memory_baselines/pilot_memory_baselines_local_empty_input_bug_format_shuffled_skill_seed1.md",
      "trajectory_path": "trajectories/pilot_memory_baselines/pilot_memory_baselines_local_empty_input_bug_format_shuffled_skill_seed1.json",
      "prepare_command": "python scripts/prepare_task.py tasks/train/local_empty_input_bug.json --workspace workspaces/runs/pilot_memory_baselines --checkout-id pilot_memory_baselines_local_empty_input_bug_format_shuffled_skill_seed1 --force",
      "baseline_context_path": null,
      "memory_path": "memory/test_failure_triage/format_shuffled_skill.md",
      "requires_memory_artifact": true,
      "prompt_status": "ready"
    },
    {
      "run_id": "pilot_memory_baselines_local_empty_input_bug_auto_skill_seed1",
      "task_id": "local_empty_input_bug",
      "task_path": "tasks/train/local_empty_input_bug.json",
      "method": "auto_skill",
      "seed": 1,
      "workspace_path": "workspaces/runs/pilot_memory_baselines/pilot_memory_baselines_local_empty_input_bug_auto_skill_seed1/repo",
      "artifacts_dir": "runs/pilot_memory_baselines/pilot_memory_baselines_local_empty_input_bug_auto_skill_seed1",
      "prompt_path": "prompts/runs/pilot_memory_baselines/pilot_memory_baselines_local_empty_input_bug_auto_skill_seed1.md",
      "trajectory_path": "trajectories/pilot_memory_baselines/pilot_memory_baselines_local_empty_input_bug_auto_skill_seed1.json",
      "prepare_command": "python scripts/prepare_task.py tasks/train/local_empty_input_bug.json --workspace workspaces/runs/pilot_memory_baselines --checkout-id pilot_memory_baselines_local_empty_input_bug_auto_skill_seed1 --force",
      "baseline_context_path": null,
      "memory_path": "memory/test_failure_triage/auto_skill.md",
      "requires_memory_artifact": true,
      "prompt_status": "ready"
    }
  ]
}
